url;meta
https://uatp4auc2.economiedenergie.fr/programme-eco-energie/Qui-peut-beneficier-du-Coup-de-pouce/;Tous les ménages peuvent-ils bénéficier du Coup de pouce Chauffage ? Quel est le montant de la prime ? Découvrez qui peut bénéficier du Coup de pouce Chauffage
https://uatp4auc2.economiedenergie.fr/aide/Qui-peut-beneficier-de-la-prime-634/;https://uatp4auc2.economiedenergie.fr/aide/Qui-peut-beneficier-de-la-prime-634/
https://uatp4auc2.economiedenergie.fr/les-travaux-eligibles/travaux-isolation-thermique/fenetre-ou-porte-fenetre/;Travaux de rénovation énergétique - Les travaux éligibles à la prime énergie : changement de fenêtre ou porte-fenêtre  – Constituer mon dossier
https://uatp4auc2.economiedenergie.fr/mon-espace/?mod=inscrire;Pour bénéficier de la Prime Eco Energie, accéder à mon espace, savoir comment créer mon dossier. Cliquer pour s’inscrire ou se connecter après inscription
https://uatp4auc2.economiedenergie.fr/les-travaux-eligibles/travaux-isolation-thermique/isolation-des-rampants-de-toiture/;Travaux de rénovation : comment bénéficier de la prime pour isoler ses combles, conditions de la prime pour travaux d’isolation thermique
https://uatp4auc2.economiedenergie.fr/mon-espace/;Accéder à Mon espace Prime Eco Energie pour créer mon dossier travaux et suivre l’avancement
https://uatp4auc2.economiedenergie.fr/les-travaux-eligibles/travaux-isolation-thermique/isolation-des-combles-perdus/;Isoler ses combles - Comment bénéficier de la prime pour travaux de rénovation ? Quelles sont les conditions de la prime pour les travaux d’isolation thermique ?
https://uatp4auc2.economiedenergie.fr/les-travaux-eligibles/travaux-isolation-thermique/fenetre-de-toiture/;Comment bénéficier de la prime CEE pour vos travaux de rénovation et d'isolation thermique des fenêtres de toiture et portes-fenêtres ? Les conditions ici.
https://uatp4auc2.economiedenergie.fr/aide/la-carte-de-fidelite-auchan/Le-fonctionnement-de-la-Prime-Eco-Energie/;Fonctionnement de la Prime Energie Auchan : comment est versée l’aide Auchan ? Puis-je utiliser ma prime CEE sur les sites Auchan avec ma carte de fidélité Auchan ?
https://uatp4auc2.economiedenergie.fr/conseils-renovation/isolation-thermique/isolations-des-planchers/;Isoler le plancher fait partie des travaux de rénovation habitat éligibles à la Prime Energie. Demandez la Prime Auchan - Isolation du plancher
https://uatp4auc2.economiedenergie.fr/aide/L-offre-Coup-de-pouce-Economies-d-Energie/Qui-peut-beneficier-du-Coup-de-pouce-2012/;Qui peut bénéficier du coup de pouce chauffage ? Quels ménages peuvent avoir la prime coup de pouce ? Coup de pouce prime énergie : les conditions de ressources
https://uatp4auc2.economiedenergie.fr/aide/qui-peut-beneficier-de-la-prime/Si-mon-installateur-fait-appel-a-une-entreprise-sous/;FAQ Prime Eco Energie Auchan – Qui peut avoir la prime ? Puis-je en bénéficier si mon installateur fait appel à une entreprise sous-traitante ?
https://uatp4auc2.economiedenergie.fr/aide/le-choix-de-l-artisan/Si-mon-installateur-fait-appel-a-une-entreprise-sous-14060/;Mon artisan fait appel à une entreprise sous-traitante : puis-je bénéficier de la prime Eco Energie ? Conditions prime énergie CEE entreprise sous-traitante
https://uatp4auc2.economiedenergie.fr/aide/qui-peut-beneficier-de-la-prime/Qui-peut-beneficier-de-la-prime-14034/;Travaux de rénovation énergétique, travaux d’économie d’énergie, si vous avez un projet, vous pouvez bénéficier de la prime Eco Energie. Vérifier mon éligibilité
https://uatp4auc2.economiedenergie.fr/aide/Les-controles-de-travaux/Les-controles-qualite-de-vos-travaux/;Les travaux d’isolation et d’économies d’énergie sont soumis au contrôle qualité. Qu'est-ce que le contrôle qualité travaux ? Contrôle après travaux, explications